2018-0443-MNG,2018,443,,Natural,Meteorological,Storm,Convective storm,Winter storm/Blizzard,,Mongolia,MNG,Eastern Asia,Asia,"Naranbulag, Zavkhan, Ulgii, Umnugovi, Sagil, Tarialan, Ulaangom, Khovd (Zavkhan), Ulgii, Altantsugts (Bayan-Ulgii), Darvi, Tsetseg, Munkhkhairkhan, Must, Jargalant, Chandmani, Zereg, Erdeneburen (Khovd), Bugat, Tonkhil, Tugrug, Khukhmorit (Govi-Altai); Uvs",,,,,,,,,Kph,,,,,2018,11,25,2018,11,28,,,,,,,,,,,,92.6696698,2,,21472;21478;21571;21577;21581;21582;21610;21611;21614;21616;21618;21619;21621;21623;21739;21742;21743;21744;21746;21747;21748,"Altanco'gc, Bugat, Ceceg, Chandmani, Darvi, Erdenebu'ren, Jargalant, Mo'nxxairxan, Mo'st, Naranbulag, O'lgii, O'mnogovi, Sagil, Tarialan, To'grog, Tonkhil, Xo'xmorit, Xovd, Zavxan, Zereg (Adm2)."
2018-0249-MNG,2018,249,FL-2018-000092,Natural,Hydrological,Flood,Flash flood,,,Mongolia,MNG,Eastern Asia,Asia,"Arkhangai, Bulgan, Dornogovi, Umnugobi, Sukhbaatar, Selenge, Tuv, Khovd, Bayan-Ulgii, Zavkhan, Uvurkhangai, Khuvsgul, Bayanzurkh provinces",Heavy rains,,,,,,,,Km2,,,,,2018,7,3,2018,7,5,,,8301,,8301,,,,,,,92.6696698,1;2,2075;2076;2078;2082;2087;2088;2089;2091;2092;2093;2094;2097,123575,"Arxangai, Bayan-O'lgii, Bulgan, Dornogovi, O'mnogovi, O'vorxangai, Selenge, Su'xbaatar, To'v, Xo'vsgol, Xovd, Zavxan (Adm1). Bayanzu'rx (Adm2)."
2018-0073-MNG,2018,73,CW-2018-000011,Natural,Meteorological,Extreme temperature,Severe winter conditions,,Dzud,Mongolia,MNG,Eastern Asia,Asia,"Arkhangai, Bayankhongor, Darkhan, Dornogobi, Umnugobi, Tuv, Uvs provinces",,,,,,,,-47,°C,,,,,2018,1,,2018,2,,,,264000,,264000,,,,,,,92.6696698,1,2075;2077;2079;2082;2089;2094;2096,,"Arxangai, Bayanxongor, Darxan-Uul, Dornogovi, O'mnogovi, To'v, Uvs (Adm1)."
2018-0039-MOZ,2018,39,FL-2018-000018,Natural,Hydrological,Landslide,,,,Mozambique,MOZ,Eastern Africa,Africa,Hulene (Maputo),Heavy rains,,,,,,,,,,,,,2018,2,18,2018,2,19,17,,300,,300,,,,,,,92.6696698,2,,41374,Cidade de Maputo (Adm2).
2018-0048-MOZ,2018,48,,Natural,Hydrological,Flood,,,,Mozambique,MOZ,Eastern Africa,Africa,"Nampula, Niassa, Cabo Delgado, Mozambique Isl.",Heavy rains,,,,,,,,Km2,,,,,2018,1,16,2018,1,22,11,,,77150,77150,,,,,5100,5503,92.6696698,1,2112;2118;2119,,"Cabo Delgado, Nampula, Niassa (Adm1)."
2018-9469-MRT,2018,9469,DR-2018-000063,Natural,Climatological,Drought,Drought,,,Mauritania,MRT,Western Africa,Africa,,Irregular seasonal rainfall in 2017,,,Yes,,,,,Km2,,,,,2018,3,,2019,12,,,,350600,,350600,,,,,,,92.6696698,2,,19494;19503;19508,"Barkeol, Maghta Lahjar, Monguel (Adm2)."
2018-0104-MWI,2018,104,FL-2018-000029,Natural,Hydrological,Flood,Flash flood,,,Malawi,MWI,Eastern Africa,Africa,"Chikwawa District; Ntandire Township, Lilongwe",Heavy rain,,,,,,,60622,Km2,-14.926,34.367,,,2018,2,22,2018,3,7,,,200,,200,,,,,,,92.6696698,2,,19310;19322,"Chikwawa, Lilongwe (Adm2)."
2018-0064-MWI,2018,64,,Natural,Hydrological,Flood,,,,Malawi,MWI,Eastern Africa,Africa,"Karonga, Kyungu, Salima, Lilongwe district, Phalombe",Heavy rains,,,,,,,25660,Km2,-10.351,33.847,,North Rukuru River,2018,2,1,2018,2,14,1,,300,,300,,,,,,,92.6696698,2,,19317,Karonga (Adm2).
2018-0164-MWI,2018,164,,Natural,Hydrological,Flood,,,,Malawi,MWI,Eastern Africa,Africa,"Bundi, Chankholombe (Karonga District); Salima and Nkhotakota districts",Heavy Rain,,,,,,,37320,Km2,-11.158,34.02,,"Rukuru, Rufilya, Kibwe, Changwima, Kyungu, Iponga and Songwe Rivers",2018,4,11,2018,4,17,4,,9113,,9113,,,,,,,92.6696698,2,,19312;19315;19317,"Karonga, Nkhotakota, Salima (Adm2)."
2018-0063-MYS,2018,63,,Natural,Hydrological,Flood,Flash flood,,,Malaysia,MYS,South-Eastern Asia,Asia,"Samarahan, Bintulu, Serian, Mukah, Limbang, Sarikei (Sarawak State)",Heavy rains,,,,,,,74296,Km2,3.133,3.659,,,2018,2,3,2018,2,12,,,4900,,4900,,,,,,,92.6696698,2,,37430;37438;37444;37445;37447;37448,"Bintulu, Limbang, Mukah, Samarahan, Sarikei, Serian (Adm2)."
2018-0068-MYS,2018,68,,Natural,Hydrological,Flood,,,,Malaysia,MYS,South-Eastern Asia,Asia,"Kuantan, Rompin, Pekan, Jerantut, Lipis, Bera districts (Pahang state), Johor, Terengganu states",Monsoonal rains,,,,,,,117492,Km2,3.659,102.337,,"Junjung, Pahang, Pahang di Lubuk Paku rivers",2018,1,1,2018,1,5,2,,12000,,12000,,,,,,,92.6696698,1;2,1891;1901,37380;37381;37382;37384;37386;37401;37404;37464;37466,"Johor, Sabah (Adm1). Dungun, Jerantut, Kemaman, Kuantan, Lipis, Pekan, Rompin, Seberang Perai Selatan, Timur Laut (Adm2)."
2018-0298-NER,2018,298,EP-2018-000132,Natural,Biological,Epidemic,Bacterial disease,,Cholera,Niger (the),NER,Western Africa,Africa,"Madarounfa, Maradi Commune, Guidan Roumdji, Dakoro, Aguié (Maradi region), Gaya (Dosso region), Damagaran Takaya, Mirriah (Zinder region), Birni NKonni, Malbaza, Keita and Madaoua (Tahoua region).",,,,,,,,,Vaccinated,,,,,2018,7,5,2018,10,1,78,3824,,,3824,,,,,,,92.6696698,,,,
2018-0232-NER,2018,232,,Natural,Hydrological,Flood,,,,Niger (the),NER,Western Africa,Africa,"Maradi, Agadez, Diffa , Zinder",,,,,,,,,Km2,,,,,2018,6,,2018,8,31,36,,130468,,130468,,,,,,,92.6696698,1,2202;2203;2205;2209,,"Agadez, Diffa, Maradi, Zinder (Adm1)."
2018-0077-NGA,2018,77,EP-2018-000022,Natural,Biological,Epidemic,Viral disease,,Lassa fever,Nigeria,NGA,Western Africa,Africa,"Anambra, Bauchi, Benue, Delta, Ebonyi, Edo, Ekite, Federal Capital Territory, Gombe, Imo, Kogi, Lagos, Nasarawa, Ondo, Osun, Plateau, Rivers, Taraba",,,,,,,,,Vaccinated,,,,,2018,1,1,2018,7,8,90,1081,,,1081,,,,,,,92.6696698,,,,
2018-0238-NGA,2018,238,FL-2018-000120,Natural,Hydrological,Flood,,,,Nigeria,NGA,Western Africa,Africa,"Jibia district; Yobe, Edo, Ogun, Katsina, Ondo, Baucho, Niger, Abuja states",Torrential rains,,,,,,,,Km2,,,,,2018,7,13,2018,7,16,101,171,15701,,15872,,,,,,,92.6696698,1,2219;2221;2226;2231;2232;2240;65699;65706,,"Abuja, Bauchi, Edo, Katsina, Niger, Ogun, Ondo, Yobe (Adm1)."
2018-0365-NGA,2018,365,,Natural,Hydrological,Flood,,,,Nigeria,NGA,Western Africa,Africa,"Kogi, Delta, Anambra, Niger",Heavy rains,,,,,Yes,,257477,Km2,10.475,8.238,,,2018,9,20,2018,10,2,199,1306,1921026,,1922332,,,,,275000,296753,92.6696698,1,2213;2218;2228;2231,,"Anambra, Delta, Kogi, Niger (Adm1)."
2018-9277-NIC,2018,9277,,Natural,Climatological,Drought,Drought,,,Nicaragua,NIC,Central America,Americas,,El Nino,,,,,,,,Km2,,,,,2018,6,,2019,3,,,,300000,,300000,,,,,,,92.6696698,1,2187;2188;2189;2190;2191;2193;2194;2195;2196;2197;2198;2199;2201,,"Boaco, Carazo, Chinandega, Chontales, Esteli, Jinotega, Leon, Madriz, Managua, Masaya, Matagalpa, Nueva Segovia, Rivas (Adm1)."
2018-0025-NLD,2018,25,,Natural,Meteorological,Storm,Extra-tropical storm,,'Friederike' (David),Netherlands (the),NLD,Western Europe,Europe,"Gelderland, Overijssel (Olst, Enschede and Vuren, Zwolle, Enschede)",,,,,,,,130,Kph,,,,,2018,1,17,2018,1,18,3,,,,,,,,,110011,118713,92.6696698,1,2161;2166,,"Gelderland, Overijssel (Adm1)."
2018-0235-NLD,2018,235,,Natural,Meteorological,Extreme temperature,Heat wave,,,Netherlands (the),NLD,Western Europe,Europe,,,,,,,,,,°C,,,,,2018,7,,2018,7,,,,,,,,,,,,,92.6696698,,,,
2018-0219-NPL,2018,219,,Natural,Hydrological,Flood,Flash flood,,,Nepal,NPL,Southern Asia,Asia,"Runtigadhi (Rolpa district); Parsa, Kailali, Banke, Dang, Sarlahi, Sindhuli districts; Tanahu, Kathmandu",Monsoonal rain,,,,,,,85852,Km2,28.238,84.398,,,2018,7,1,2018,7,11,15,6,1400,,1406,,,,,,,92.6696698,,,,
2018-0049-NPL,2018,49,,Natural,Meteorological,Extreme temperature,Cold wave,,,Nepal,NPL,Southern Asia,Asia,"SAptari, Rautahat, Siraha regions",,,,,,,,,°C,,,,,2018,1,1,2018,1,7,50,,,,,,,,,,,92.6696698,,,,
2018-0485-NZL,2018,485,,Natural,Hydrological,Flood,,,,New Zealand,NZL,Australia and New Zealand,Oceania,"Gisborne, Hawk's Bay region",Heavy rains,,,,,,,,Km2,,,,,2018,6,11,2018,6,11,,,100,,100,,,,,25000,26978,92.6696698,1,2175,,Hawke's Bay (Adm1).
2018-0143-PAK,2018,143,,Natural,Meteorological,Extreme temperature,Heat wave,,,Pakistan,PAK,Southern Asia,Asia,Karachi,,,,,,,,42,°C,,,,,2018,5,18,2018,5,22,180,,,,,,,,,,,92.6696698,2,,40392;40393;40394;40395,"Karachi Central District, Karachi East District, Karachi South District, Karachi West District (Adm2)."
2018-0212-PAK,2018,212,,Natural,Hydrological,Flood,,,,Pakistan,PAK,Southern Asia,Asia,,Heavy rains,,,,,,,,Km2,,,,,2018,5,7,2018,5,15,60,,,,,,,,,,,92.6696698,,,,
2018-9277-PAN,2018,9277,,Natural,Climatological,Drought,Drought,,,Panama,PAN,Central America,Americas,,El NIno,,,,,,,,Km2,,,,,2018,6,,2019,3,,,,,,,,,,,72000,77695,92.6696698,,,,
2018-0011-PER,2018,11,,Natural,Geophysical,Earthquake,Ground movement,,,Peru,PER,South America,Americas,"Yauca, Quicaca, Acari, Jaqui, Lomas districts (Caraveli Province), Rio Grande district (Condesuyos province) (Arequipa department), Sancos district, Lucanas, Pullo district, Parinacochas, Paucar del Sara Sara provinces (Ayacucho department), Nazca district (Nazca province-Ica department)",,,,,,,,7,Richter,-15.759,74.71,4:18,,2018,1,14,2018,1,14,2,139,7885,1295,9319,,,,,,,92.6696698,2,,24041;24044;24053;24054;24055;24105,"Caravel??, Condesuyos, Lucanas, Nazca, Parinacochas, Paucar del Sara Sara (Adm2)."
2018-0014-PHL,2018,14,VO-2018-000005,Natural,Geophysical,Volcanic activity,Lava flow,,Mt. Mayon,Philippines (the),PHL,South-Eastern Asia,Asia,"Bacacay, Daraga, Legazpi, Ligao, Santo Domingo, Tabao, Camalig, Guinobatan, Malilipot municipalities (Bicol region, Albay province)",,,,Yes,,Yes,,,,,,,,2018,1,13,2018,3,6,,,86056,,86056,,,,,3564,3846,92.6696698,2,,24240,Albay (Adm2).
2018-0004-PHL,2018,4,,Natural,Meteorological,Storm,Tropical cyclone,,Agaton (01W),Philippines (the),PHL,South-Eastern Asia,Asia,"Aklan, Capiz (Region VI); Bohol, Cebu (Region VII); Camiguin, Lanao del NOrte, Misamis Oriental (Region X); Agusan del NOrte, Dinagat Isl., Surigao del Norte , Surigao del Sur (Caraga)",,,,,,,,,Kph,,,,,2018,1,1,2018,1,3,3,9,83908,,83917,,,,,12292,13264,92.6696698,2,,24246;24248;24252;24253;24263;24265;24272;24275;24278;67168;67169,"Agusan Del Norte, Aklan, Bohol, Camiguin, Capiz, Cebu, Dinagat, Lanao Del Norte, Misamis Oriental, Surigao Del Norte, Surigao Del Sur (Adm2)."
2018-0347-PHL,2018,347,,Natural,Meteorological,Storm,Tropical cyclone,,Tropical Storm Yagi,Philippines (the),PHL,South-Eastern Asia,Asia,"I, III, CAR, NCR, and CALABARZON",,,,,,,,,Kph,,,,,2018,9,19,2018,9,19,5,,1709511,,1709511,,,,,19000,20503,92.6696698,1,2354;2356;67165;67166,,"Cordillera Administrative region (CAR), Region I (Ilocos region), Region III (Central Luzon), Region IV-A (Calabarzon) (Adm1)."
2018-0486-PHL,2018,486,,Natural,Biological,Epidemic,Viral disease,,Measles,Philippines (the),PHL,South-Eastern Asia,Asia,,,,,,,,,,Vaccinated,,,,,2018,1,,2018,12,,202,21812,,,21812,,,,,,,92.6696698,,,,
2018-0051-PHL,2018,51,,Natural,Hydrological,Flood,,,,Philippines (the),PHL,South-Eastern Asia,Asia,"Bicol, Dvao, Eastern Visayas, NOrthern Mindanao, Western Visayas",Heavy rains,,,,,,,,Km2,,,,,2018,1,13,2018,1,17,11,,180000,,180000,,,,,,,92.6696698,2,,24258;24259;24266,"Compostela, Leyte, Northern Samar (Adm2)."
2018-0481-PLW,2018,481,,Natural,Biological,Epidemic,Viral disease,,Dengue,Palau,PLW,Micronesia,Oceania,"Koror, Airai, Ngarchelong, Melekeok, Aimeliik, Ngeremlengui, Peleliu, Ngchesar states",,,,,,,,,Vaccinated,,,,,2018,12,7,2019,3,17,,124,,,124,,,,,,,92.6696698,,,,
2018-0316-PNG,2018,316,,Natural,Geophysical,Earthquake,Ground movement,,,Papua New Guinea,PNG,Melanesia,Oceania,South Highlands,,,,,,,,,Richter,-6.307,142.62,5:56,,2018,3,5,2018,3,5,11,,,,,,,,,,,92.6696698,1,2305,,Southern Highlands (Adm1).
2018-0317-PNG,2018,317,,Natural,Geophysical,Earthquake,Ground movement,,,Papua New Guinea,PNG,Melanesia,Oceania,Hela (South Highlands),,,,,,,,7,Richter,-6.294,142.607,0:13,,2018,3,7,2018,3,7,25,,,,,,,,,,,92.6696698,1,2305,,Southern Highlands (Adm1).
2018-0017-PNG,2018,17,VO-2018-000002,Natural,Geophysical,Volcanic activity,,,,Papua New Guinea,PNG,Melanesia,Oceania,"Manot, Taragauo, Dong Sarakbano, Niukatnam, Rumgio (Kadovar islands)",,,,,,,,,,,,,,2018,1,5,2018,1,6,,,736,,736,,,,,,,92.6696698,2,,37488,Wewak (Adm2).
2018-0061-POL,2018,61,,Natural,Meteorological,Extreme temperature,Cold wave,,,Poland,POL,Eastern Europe,Europe,,,,,,,,,,°C,,,,,2018,2,23,2018,2,28,9,,,,,,,,,,,92.6696698,,,,
2018-9187-POL,2018,9187,,Natural,Climatological,Drought,Drought,,,Poland,POL,Eastern Europe,Europe,,,,,,,,,,Km2,,,,,2018,6,,2018,7,,,,,,,,,,,,,92.6696698,,,,
2018-0218-PRI,2018,218,,Natural,Hydrological,Flood,,,,Puerto Rico,PRI,Caribbean,Americas,"San Juan, Las Piedras",Storm Beryl,,,,,,,,Km2,,,,,2018,7,9,2018,7,11,,,400,,400,,,,,,,92.6696698,1,2418;2421,,"Humacao, San Juan (Adm1)."
2018-0329-PRK,2018,329,FL-2018-000144,Natural,Hydrological,Flood,,,,Korea (the Democratic People's Republic of),PRK,Eastern Asia,Asia,"Pyongsan, Kumchon, Jangpung, Kaesong counties (North Hwanghae); Haeju, Taetan, Siwon, Pongchon, Changdan counties (South Hwanghae)",Torrential rains,,,,,,,25734,Km2,38.531,126.573,,,2018,8,24,2018,9,6,148,,581268,,581268,,,,,25000,26978,92.6696698,1,1059;1063,,"Hwanghae-bukto, Hwanghae-namdo (Adm1)."
2018-0376-PRT,2018,376,,Natural,Meteorological,Storm,Tropical cyclone,,Storm 'Leslie',Portugal,PRT,Southern Europe,Europe,"Coimbra, Leiria dsitricts",,,,,,,,176,Kph,,,,,2018,10,14,2018,10,16,2,28,60,,88,,,60000,64746,115500,124636,92.6696698,1,2391;2405,,"Coimbra, Leiria (Adm1)."
2018-0235-PRT,2018,235,,Natural,Meteorological,Extreme temperature,Heat wave,,,Portugal,PRT,Southern Europe,Europe,,,,,,,,,45,°C,,,,,2018,8,,2018,8,,,,,,,,,,,,,92.6696698,,,,
2018-0066-PRY,2018,66,,Natural,Hydrological,Flood,Riverine flood,,,Paraguay,PRY,South America,Americas,"Bañado Norte, Chacarita, Bañado Sur",Heavy rains,,,,,,,2924,Km2,-25.312,-57.599,,,2018,1,13,2018,1,22,,,5000,,5000,,,,,,,92.6696698,2,,23849,Asuncion (Adm2).
2018-0442-PRY,2018,442,FL-2018-000419,Natural,Hydrological,Flood,,,,Paraguay,PRY,South America,Americas,"Banado Norte, Chacarita, Banado Sur",,,,,,,,,Km2,,,,Paraguay River's middle basin,2018,11,1,2018,11,19,,,41300,,41300,,,,,,,92.6696698,2,,23849,Asuncion (Adm2).
2018-0390-QAT,2018,390,,Natural,Hydrological,Flood,Flash flood,,,Qatar,QAT,Western Asia,Asia,Doha,Heavy rains,,,,,,,,Km2,,,,,2018,10,20,2018,10,20,,,1500,,1500,,,,,10000,10791,92.6696698,1,2422,,Ad Dawhah (Adm1).
2018-0247-ROU,2018,247,,Natural,Hydrological,Flood,Flash flood,,,Romania,ROU,Eastern Europe,Europe,"Bac?u, Brasov, Harghita, Neamt, Vrancea",,,,,,,,,Km2,,,,,2018,6,29,2018,7,2,,,1200,,1200,,,,,,,92.6696698,1,2449;2454;2467;2474;2486,,"Bacau, Brasov, Harghita, Neamt, Vrancea (Adm1)."
2018-0061-ROU,2018,61,,Natural,Meteorological,Extreme temperature,Cold wave,,,Romania,ROU,Eastern Europe,Europe,,,,,,,,,,°C,,,,,2018,2,23,2018,2,28,2,,,,,,,,,,,92.6696698,,,,
2018-0113-RUS,2018,113,FL-2018-000046,Natural,Hydrological,Flood,,,,Russian Federation (the),RUS,Eastern Europe,Europe,"Tyva Republic, Altai Krai; Kumylzhensky, Mikhailovsky, Kikvidzensky, Frolovsky, Rudnyansky, Elansky, Novoannensky, Kletsky, Olkhovsky, Alekseevsky, Ilovlinsky, Uryupinsky (Volgorad region) - South Siberia",Melting snow,,,,,Yes,,172030,Km2,52.883,84.596,,,2018,3,25,2018,4,16,2,,3672,,3672,,,,,,,92.6696698,1,2490;2567;2572,,"Altayskiy Kray, Tyva Rep., Volgogradskaya Oblast (Adm1)."
2018-0477-RWA,2018,477,,Natural,Hydrological,Flood,,,,Rwanda,RWA,Eastern Africa,Africa,,,,,,,,,,Km2,,,,,2018,4,1,2018,4,16,10,,,,,,,,,11000,11870,92.6696698,,,,
2019-0020-MDG,2019,20,,Natural,Hydrological,Flood,,,,Madagascar,MDG,Eastern Africa,Africa,Antananarivo,Heavy rains,Collapse,"Slide (land, mud, snow, rock)",,,,,,Km2,,,,,2019,1,19,2019,1,20,9,,,,,,,,,,,94.3490925,2,,123870;123871;123872;123873;123874;123875;154522;154523,"Antananarivo Atsimondrano, Antananarivo Avaradrano, Antananarivo I, Antananarivo II, Antananarivo III, Antananarivo IV, Antananarivo V, Antananarivo VI (Adm2)."
2019-0072-PER,2019,72,,Natural,Hydrological,Flood,,,,Peru,PER,South America,Americas,"Apurimac, Arequipa, Ayacucho, Cusco, Huancavelica, Ica, Lima, Moquegua, Puno, Tacna",,Storm,"Slide (land, mud, snow, rock)",,,,,,Km2,,,,,2019,2,21,2019,2,28,51,79,8300,,8379,,,,,,,94.3490925,1,2330;2331;2332;2335;2336;2338;2342;2345;2348;2350,,"Apurimac, Arequipa, Ayacucho, Cusco, Huancavelica, Ica, Lima, Moquegua, Puno, Tacna (Adm1)."
2019-0321-IND,2019,321,,Natural,Meteorological,Storm,Convective storm,Lightning/Thunderstorms,,India,IND,Southern Asia,Asia,"Uttar Pradesh, Maharashtra, and Bihar",,Flood,Hail,,,,,,Kph,,,,,2019,6,6,2019,6,14,50,,,,,,,,,,,94.3490925,1,1498;70073;70081,,"Bihar, Maharashtra, Uttar Pradesh (Adm1)."
2019-0225-MEX,2019,225,,Natural,Hydrological,Flood,,,,Mexico,MEX,Central America,Americas,San Gabriel municipality (Jalisco state),Heavy rains,"Slide (land, mud, snow, rock)",Storm,,,,,34620,Km2,20.176,-103.182,,Apango and Salsipuedes rivers,2019,6,2,2019,6,6,7,,,3000,3000,,,,,,,94.3490925,2,,20107,Ciudad Venustiano C. (Adm2).
2019-0222-ROU,2019,222,,Natural,Hydrological,Flood,,,,Romania,ROU,Eastern Europe,Europe,"Bihor, Iasi and Vaslui regions.",,Hail,Storm,,,,,88755,Km2,45.624,26.653,,,2019,5,31,2019,6,7,4,,362,,362,,,,,,,94.3490925,1,2450;2470;2484,,"Bihor, Iasi, Vaslui (Adm1)."
2019-0141-IRQ,2019,141,,Natural,Hydrological,Flood,,,,Iraq,IRQ,Western Asia,Asia,"Anbar, Basra, Dahuk, Diyala, Kirkuk, Missan, Muthanna, Ninewa, Salah al-Din, Sulaymaniyah, and Wassit governorates",,,Storm,,,,,,Km2,,,,,2019,3,24,2019,4,2,10,,5865,,5865,,,,,,,94.3490925,1,1564;1565;1566;1570;1574;1575;1577;1578;1579;1580;1581,,"Anbar, Basrah, Dahuk, Diyala, Kirkuk, Missan, Muthanna, Ninewa, Salah al-Din, Sulaymaniyah, Wassit (Adm1)."
2019-0056-MNG,2019,56,,Natural,Meteorological,Extreme temperature,Severe winter conditions,,,Mongolia,MNG,Eastern Asia,Asia,"Bayan-Ulgii, Uvs, Khovd, Govi-Altai, Zavkhan, Bayankhongor, Uvurkhangai, Arkhangai provinces",,Cold wave,Snow/ice,,,,,-48,°C,,,,,2019,1,11,2019,2,20,,,2000,,2000,,,,,,,94.3490925,1,2075;2076;2077;2085;2087;2091;2096;2097,,"Arxangai, Bayan-O'lgii, Bayanxongor, Govi-Altai, O'vorxangai, Uvs, Xovd, Zavxan (Adm1)."
2019-0005-LBN,2019,5,,Natural,Meteorological,Storm,Convective storm,Severe storm,Storm 'Norma',Lebanon,LBN,Western Asia,Asia,"Spears, Gemmayzeh (Beirut); Jbeil, Journieh, Antelias, Chouf (Mont Lebanon); Halba, Tripoli (North); Saida, Nabatieh, TYr (South); Zahle, Rashaya (Bekaa)",,Flood,Snow/ice,,,,,,Kph,,,,,2019,1,11,2019,1,17,3,9,11000,,11009,,,,,,,94.3490925,1;2,1798,18794;18795;18797;18802;18805;18806;18809;18810;18812;18816,"Beirut (Adm1). Akkar, Chouf, El Metn, Jubail, Nabatiye, Rachiaya, Saida, Sour, Tripoli, Zahle (Adm2)."
2019-0022-IDN,2019,22,,Natural,Hydrological,Flood,,,,Indonesia,IDN,South-Eastern Asia,Asia,"Kebumen (Banyumas district); Mojokerto, Bojonegoro, Purworedjo, Cilacap districts (Central Java)",Heavy rains,"Slide (land, mud, snow, rock)",,,,,,,Km2,,,,,2019,1,17,2019,1,17,2,,2650,,2650,,,,,,,94.3490925,2,,18036;18041;18055;18067;18086,"Bojonegoro, Cilacap, Kebumen, Mojokerto, Purworejo (Adm2)."
2019-0107-IDN,2019,107,,Natural,Hydrological,Flood,,,,Indonesia,IDN,South-Eastern Asia,Asia,"Java Isl., western Timor",Heavy rains,"Slide (land, mud, snow, rock)",,,,,,,Km2,,,,,2019,3,6,2019,3,8,9,4,168393,,168397,,,,,,,94.3490925,1,1515;1516;1520;1521;1529;73610;73613,,"Banten, Daerah Istimewa Yogyakarta, Dki Jakarta, Jawa Barat, Jawa Tengah, Jawa Timur, Nusatenggara Timur (Adm1)."
2019-0168-IDN,2019,168,,Natural,Hydrological,Flood,,,,Indonesia,IDN,South-Eastern Asia,Asia,"Bengkulu city, Kaur, North Bengkulu, Central Bengkulu, South Bengkulu, Seluma, Kapahiang, Lebong, Rejang Lebong districts (Bengkulu Province)",Heavy rains,"Slide (land, mud, snow, rock)",,,,,,,Km2,,,,,2019,4,25,2019,5,27,18,2,13000,,13002,,,,,15000,15898,94.3490925,2,,73653;73654;73692;73712;73774;73834;73844;73882,"Bengkulu Selatan, Bengkulu Utara, Kaur, Kepahiang, Kota Bengkulu, Lebong, Rejanglebong, Seluma (Adm2)."
2019-0125-IRN,2019,125,,Natural,Hydrological,Flood,,,,Iran (Islamic Republic of),IRN,Southern Asia,Asia,"Kermanshah, Golestan, Mazandaran, North Khorasan, Semnan, Fars, Kurdistan, Qom, Isfahan, Khuzestan, Chaharmahal, Bakhtiari, Kohkilouyen, Boyerahmad, Markazi, Lorestan, Hamadan, Sistan, Baluchestan, Gilan",Heavy rains,"Slide (land, mud, snow, rock)",,,,,,,Km2,,,,,2019,3,19,2019,4,10,70,1076,10000000,,10001076,,,200000,211979,2500000,2649734,94.3490925,1;2,1539;1541;1544;1545;1546;1551;1552;1553;1555;1556;1557;1558;1559;1562;33111;33113,40910;40940;40978;41113,"Chaharmahal-o bakhtiyar, Fars, Ghom, Gilan, Golestan, Hamedan, Kermanshah, Khuzestan, Kohgiluyeh va boyerahma, Kordestan, Lorestan, Markazi, Mazandaran, Semnan, Sistan-o baluchestan, Yazd (Adm1). Bojnord, Esfarayen, Jajarm, Shirvan (Adm2)."
2019-0322-JPN,2019,322,,Natural,Geophysical,Earthquake,Ground movement,,,Japan,JPN,Eastern Asia,Asia,"Yamagata, Miyagi, Niigata,Ishikawa (Honshu Island)",,"Slide (land, mud, snow, rock)",,,,,,6,Richter,38.637,139.48,,,2019,6,18,2019,6,18,,28,432,,460,,,,,,,94.3490925,1,1664;1673;1678;1695,,"Isikawa, Miyagi, Niigata, Yamagata (Adm1)."
2019-0110-MOZ,2019,110,TC-2019-000021,Natural,Meteorological,Storm,Tropical cyclone,,Cyclone 'Idai',Mozambique,MOZ,Eastern Africa,Africa,"Beira (Sofala province); Zambezia, Manica and Inhambane provinces",,"Slide (land, mud, snow, rock)",,Yes,,Yes,,140,Kph,,,,,2019,3,14,2019,3,15,603,1500,1500000,,1501500,,,150000,158984,2000000,2119787,94.3490925,1;2,2114;2115;2122,65263,"Inhambane, Manica, Zambezia (Adm1). Cidade da Beira (Adm2)."
2019-0082-PAK,2019,82,,Natural,Hydrological,Flood,,,,Pakistan,PAK,Southern Asia,Asia,Khyber Pakhtunkhwa province; Lasbellla district (Balochistan Province),Torrential rains,"Slide (land, mud, snow, rock)",,,,Yes,,,Km2,,,,,2019,2,20,2019,3,,25,22,,,22,,,,,,,94.3490925,2,,23622;23632,"Khyber Agency, Lasbela District (Adm2)."
2019-0093-PER,2019,93,,Natural,Hydrological,Flood,,,,Peru,PER,South America,Americas,"Arequipa, Ancash, Loreto, Tacna, Moquegua",Heavy rains,"Slide (land, mud, snow, rock)",,,,,,,Km2,,,,,2019,2,7,2019,2,7,10,,,,,,,,,,,94.3490925,1,2329;2331;2343;2345;2350,,"Ancash, Arequipa, Loreto, Moquegua, Tacna (Adm1)."
2019-0098-PNG,2019,98,,Natural,Hydrological,Flood,Flash flood,,,Papua New Guinea,PNG,Melanesia,Oceania,"Gazelle, Pomio, Rabaul, Kokopo districts (East New Britain province)",Heavy rains,"Slide (land, mud, snow, rock)",,,,,,,Km2,,,,,2019,2,11,2019,2,25,2,,,350,350,,,,,,,94.3490925,1,2292,,East New Britain (Adm1).
2019-0288-IND,2019,288,,Natural,Hydrological,Flood,,,,India,IND,Southern Asia,Asia,"Mumbai, Pune, Ratnagiri Districts (Maharashtra State)",Monsoon,Broken Dam/Burst bank,,,,,,,Km2,,,,,2019,6,28,2019,7,4,52,60,,,60,,,,,,,94.3490925,2,,17776;17778;70184,"Mumbai city, Pune, Ratnagiri (Adm2)."
2019-0055-MDA,2019,55,CW-2019-000013,Natural,Meteorological,Extreme temperature,Severe winter conditions,,,Moldova (the Republic of),MDA,Eastern Europe,Europe,"Edinet, Telenesti, Calaras, Ungheni, Basarabeasca, Criuleni, Anenii Noi",,Cold wave,,,,,,,°C,,,,,2019,1,11,2019,1,30,,,5460,,5460,,,,,,,94.3490925,2,,41175;41176;41189;41193;41199;41207;41209,"Anenii Noi, Basarabeasca, Calaras, Criuleni, Edinet, Telenesti, Ungheni (Adm2)."
2019-0013-IDN,2019,13,FL-2019-000011,Natural,Hydrological,Landslide,Landslide,,,Indonesia,IDN,South-Eastern Asia,Asia,"Jenepoto, Maros, Gowa, Makassar-city, Soppeng, Wajo, Barru, Pangkep, Sidra, Bantaeng, Takalar, Selayar, Sinjai districts (Celebes Isl., Sulawesi province)",Heavy rains,Flood,,,,,,,,,,,,2019,1,21,2019,1,23,84,47,6596,,6643,,,,,,,94.3490925,2,,18167;18168;18172;18173;18182;18184;18185;18186;18188;73735;73792,"Bantaeng, Barru, Gowa, Jeneponto, Kota Makasar, Maros, Selayar, Sinjai, Soppeng, Takalar, Wajo (Adm2)."
2019-0155-IND,2019,155,,Natural,Meteorological,Storm,Convective storm,,,India,IND,Southern Asia,Asia,"Gujarat, Rajasthan, Madhya Pradesh, Maharashtra",,Flood,,,,,,,Kph,,,,,2019,4,16,2019,4,17,50,,,,,,,,,,,94.3490925,1,1491;1498;1506;70079,,"Gujarat, Madhya Pradesh, Maharashtra, Rajasthan (Adm1)."
2019-9145-KEN,2019,9145,DR-2019-000024,Natural,Climatological,Drought,Drought,,,Kenya,KEN,Eastern Africa,Africa,"West Pokot, Tharaka Nithi, Samburu, Nyeri (Kieni), Marsabit, Mandera, Lamu, Laikipia, Kitui, Kilifi, Isiolo, Garissa, Embu, Baringo, Turkana, Wajir",Two consecutive poor rainy seasons,Food shortage,,Yes,,,,,Km2,,,,,2019,1,,2019,9,,,,2600000,,2600000,,,,,,,94.3490925,2,,51338;51340;51342;51347;51348;51349;51352;51359;51361;51363;51364;51377;51384;51389;51392;51394,"Baringo, Embu, Garissa, Isiolo, Kilifi, Kitui, Laikipia, Lamu, Mandera, Marsabit, Nyeri, Samburu, Tharaka, Turkana, Wajir, West Pokot (Adm2)."
2019-9023-PAK,2019,9023,DR-2018-000428,Natural,Climatological,Drought,,,,Pakistan,PAK,Southern Asia,Asia,"Thatta, Dadu, Sanghar, Tharparkar, Umerkot, Kambar Shadadkot, Jamshoro, Badin distrcits (Sindh province ); Pishin, Killa Abdullah, Noshki, Chaghi, Kharan, Washuk, Panjgur, Kech, Jhal Magsi, Awaran, Zhob, Jaffarabad, Barkhan, Quetta, Killah Saifullah, Kohlu, Naseerabad, Kachhi districts (Balochistan province)",El Nino and the decrease in the amount of rainfall during monsoon season,Food shortage,,Yes,,,,,Km2,,,,,2019,1,,2019,12,,77,,4680912,,4680912,,,,,,,94.3490925,2,,23614;23619;23621;23625;23627;23681;23682;23687;23689;23693;40289;40290;40291;40295;40296;40298;40301;40302;40308;40310;40313;40405;40407,"Awaran District, Badin District, Barkhan District, Bolan District, Chagai District, Dadu District, Jaffarabad District, Jhal Magsi District, Kech District, Kharan District, Killa Abdullah District, Killa Saifullah District, Kohlu District, Larkana District, Nasirabad District, Panjgur District, Pishin District, Quetta District, Sanghar District, Tharparkar District, Thatta District, Umer Kot District, Zhob District (Adm2)."
2019-9076-PRK,2019,9076,DR-2019-000042,Natural,Climatological,Drought,Drought,,,Korea (the Democratic People's Republic of),PRK,Eastern Asia,Asia,,"Prolonged dry spells, with erratic high temperatures and floods,",Food shortage,,,,Yes,,,Km2,,,,,2019,1,,2019,2,,,,10100000,,10100000,,,,,,,94.3490925,,,,
