2016-0544-IRN,2016,544,,Natural,Meteorological,Storm,Convective storm,Lightning/Thunderstorms,,Iran (Islamic Republic of),IRN,Southern Asia,Asia,"Golestan, Amol (Mazandaran Province)",,Flood,,,,,,,Kph,,,,,2016,9,1,2016,9,2,4,,,2000,2000,,,,,,,88.57345288,1;2,33111,40872,Golestan (Adm1). Amol (Adm2).
2016-0324-JPN,2016,324,,Natural,Meteorological,Storm,Tropical cyclone,,Typhoon Lionrock,Japan,JPN,Eastern Asia,Asia,Iwate,,Flood,,,,,,,Kph,,,,,2016,9,4,2016,9,4,22,,,,,,,,,,,88.57345288,1,1665,,Iwate (Adm1).
2016-0390-JPN,2016,390,,Natural,Meteorological,Storm,Tropical cyclone,,Typhoon Malakas,Japan,JPN,Eastern Asia,Asia,"Hyogoo, Miyazaki, Oosaka province",,Flood,,,,,,185,Kph,,,,,2016,9,20,2016,9,20,1,,6000,,6000,,,,,,,88.57345288,1,1662;1674;1682,,"Hyoogo, Miyazaki, Oosaka (Adm1)."
2016-0355-LCA,2016,355,TC-2016-000106,Natural,Meteorological,Storm,Tropical cyclone,,Hurricane 'Matthew',Saint Lucia,LCA,Caribbean,Americas,"Gros-Islet (Region Number 1 province), Castries, Bexon, Marc, (Region Number 8 province), Dennery (Region Number 3 province), Laborie, Vieux- Fort (Region Number 5 province), Micoud (Region Number 4 province), Choiseul (Region Number 6 province)",,Flood,,,,,,,Kph,,,,,2016,9,28,2016,9,28,,,25000,,25000,,,,,,,88.57345288,1,2608;2610;2611;2612;2613;2615,,"Region Number 1, Region Number 3, Region Number 4, Region Number 5, Region Number 6, Region Number 8 (Adm1)."
2016-0319-MEX,2016,319,,Natural,Meteorological,Storm,Tropical cyclone,,Hurricane Newton,Mexico,MEX,Central America,Americas,"Cabo San Lucas city (La Paz district, Baja California Sur province), Oaxaca, Colima, Jalisco provinces",,Flood,,,,,,,Kph,,,,,2016,9,6,2016,9,7,11,,10500,,10500,,,,,50000,56450,88.57345288,1;2,2035;2041;2047,19573,"Colima, Jalisco, Oaxaca (Adm1). La Paz (Adm2)."
2016-0490-PHL,2016,490,,Natural,Meteorological,Storm,Tropical cyclone,,Typhoon Helen (Megi),Philippines (the),PHL,South-Eastern Asia,Asia,"Meycauayan city, Marilao, Sta. Maria (Bulacan province)",,Flood,,,,,,,Kph,,,,,2016,9,28,2016,9,28,,,1559,,1559,,,,,,,88.57345288,2,,24221,Bulacan (Adm2).
2016-9452-KEN,2016,9452,DR-2016-000118,Natural,Climatological,Drought,Drought,,,Kenya,KEN,Eastern Africa,Africa,"Kilifi, Kwale, Tana River, Taita Taveta districts (Coast province), Wajir, Mandera districts (North Eastern province), Marsabit, Makueni, Kitui districts (Eastern province), Samburu district (Rift Valley province), Lamu, Baringo, West Poko, Garissa, Tana river, Isiolo, Laikipia, Turkana, Taita Tavetan Makueni, Narok, Embu (Mbeere), Meru, Tharaka Nithi, Nyeri",Poor performance in the long-rain time period,Food shortage,,,,Yes,,,Km2,,,,,2016,6,,2018,1,,,,3400000,,3400000,,,,,,,88.57345288,2,,51340;51341;51345;51346;51349;51351;51352;51363;51364;51389,"Kilifi, Kitui, Kwale, Makueni, Mandera, Marsabit, Samburu, Taita Taveta, Tana River, Wajir (Adm2)."
2016-0355-HTI,2016,355,TC-2016-000106,Natural,Meteorological,Storm,Tropical cyclone,,Hurricane 'Matthew',Haiti,HTI,Caribbean,Americas,"GrandAnse (Jérémie), South (Les Cayes, Les Anglais and Tiburon municipalities), Nippes, South East, West (Leogane, Port-au-Prince) and North West departments, Les Cayes",,,,Yes,,,,,Kph,,,,,2016,9,28,2016,10,7,546,439,2100000,,2100439,,,,,2000000,2258013,88.57345288,1,1414;1415;1416;1417;72911;72912,,"Grande Anse, Nippes, Nord Ouest, Ouest, Sud, Sud Est (Adm1)."
2016-0404-HTI,2016,404,,Natural,Biological,Epidemic,Bacterial disease,,Cholera,Haiti,HTI,Caribbean,Americas,"Sud, Grand'Anse deprtaments",,,,,,,,651177,Vaccinated,,,,,2016,10,,2016,10,,,6096,,,6096,,,,,,,88.57345288,,,,
2016-0458-IDN,2016,458,,Natural,Geophysical,Earthquake,Ground movement,,,Indonesia,IDN,South-Eastern Asia,Asia,Dompu district (Nusatenggara Barat Province),,,,,,,,6,Richter,-8.218,117.816,6:40,,2016,8,1,2016,8,1,,,3410,,3410,,,,,,,88.57345288,2,,18144,Dompu (Adm2).
2016-0475-IDN,2016,475,EQ-2016-000127,Natural,Geophysical,Earthquake,Ground movement,,,Indonesia,IDN,South-Eastern Asia,Asia,"Pidie Jaya district (Nangroe Aceh Darussalam province, Sumatra Isl.)",,,,,Yes,,,7,Richter,5.281,96.108,5:00,,2016,12,7,2016,12,7,104,857,85161,,86018,,,,,100000,112901,88.57345288,2,,17968,Pidie (Adm2).
2016-0479-IDN,2016,479,,Natural,Hydrological,Flood,Riverine flood,,,Indonesia,IDN,South-Eastern Asia,Asia,"Karawang, Bandung districts (Jawa Barat province)",,,,,,,,,Km2,,,,Citarum,2016,11,13,2016,11,15,5,,19669,,19669,,,,,,,88.57345288,2,,18014;73636,"Bandung, Karawang (Adm2)."
2016-0391-IND,2016,391,,Natural,Hydrological,Flood,,,,India,IND,Southern Asia,Asia,"Andhra Pradesh province, Telangana",Monsoonal rains,,,,,,,137435,Km2,17.654,80.34,,,2016,9,21,2016,9,29,28,,3000,,3000,,,44000,49676,589000,664985,88.57345288,1,1485,,Andhra Pradesh (Adm1).
2016-0554-IND,2016,554,,Natural,Hydrological,Flood,,,,India,IND,Southern Asia,Asia,"Jorhat, Golaghat (Assam State)",,,,,,,,,Km2,,,,,2016,7,17,2016,7,19,34,,,,,,,,,,,88.57345288,2,,17582;70089,"Golaghat, Jorhat (Adm2)."
2016-0442-ISR,2016,442,,Natural,Climatological,Wildfire,"Land fire (Brush, Bush, Pasture)",,,Israel,ISR,Western Asia,Asia,"Nataf, Sha'ar Hagai (Jérusalem province), Modiin (Central district province), Haifa province",DRought and high winds,,,,,,,,Km2,,,,,2016,11,18,2016,11,26,,137,60000,,60137,,,,,520000,587083,88.57345288,1,1610;1611;1612,,"Central District, Haifa, Jerusalem (Adm1)."
2016-0313-ITA,2016,313,EQ-2016-000095,Natural,Geophysical,Earthquake,Ground movement,,,Italy,ITA,Southern Europe,Europe,"Amatrice, Accumoli, Pescara del Tronto, Arquataa, Posta (Rieti and Ascoli Piceno provinces)",,,,,,Yes,,6,Richter,42.723,13.187,3:36,,2016,8,24,2016,8,24,296,400,4454,,4854,,,75000,84675,5000000,5645032,88.57345288,2,,18349;18368,"Ascoli Piceno, Rieti (Adm2)."
2016-0357-ITA,2016,357,,Natural,Geophysical,Earthquake,Ground movement,,,Italy,ITA,Southern Europe,Europe,"Visso, Ussita (Macerata district, Marche province)",,,,,,,,6,Richter,42.934,13.043,,,2016,10,26,2016,10,26,1,24,3003,,3027,,,,,200000,225801,88.57345288,2,,18369,Macerata (Adm2).
2016-0358-ITA,2016,358,,Natural,Geophysical,Earthquake,Ground movement,,,Italy,ITA,Southern Europe,Europe,"Norcia (Perugia district, Umbria province)",,,,,,,,7,Richter,42.855,13.088,7:40,,2016,10,30,2016,10,30,,20,22272,,22292,,,,,200000,225801,88.57345288,2,,18411,Perugia (Adm2).
2016-0453-ITA,2016,453,,Natural,Hydrological,Flood,Riverine flood,,,Italy,ITA,Southern Europe,Europe,"Piémont, Liguria provinces",Heavy rains,,,,,,,,Km2,,,,"Po, Tanaro, Bormida, Pellice and Dora Riparia rivers",2016,11,23,2016,11,25,2,,400,,400,,,,,100000,112901,88.57345288,1,1623;1627,,"Liguria, Piemonte (Adm1)."
2016-0355-JAM,2016,355,TC-2016-000106,Natural,Meteorological,Storm,Tropical cyclone,,Hurricane 'Matthew',Jamaica,JAM,Caribbean,Americas,St. Thomas and Portland,,,,Yes,,,,,Kph,,,,,2016,9,27,2016,10,3,,,125000,,125000,,,,,,,88.57345288,1,1639;1646,,"Portland, Saint Thomas (Adm1)."
2016-0492-JPN,2016,492,,Natural,Geophysical,Earthquake,Ground movement,,,Japan,JPN,Eastern Asia,Asia,"Kurayoshi city (Kurayosisi district, Tottori province)",,,,,,,,6,Richter,35.37,133.812,,,2016,10,21,2016,10,21,,7,480,6,493,,,,,100000,112901,88.57345288,2,,36364,Kurayosisi (Adm2).
2016-0361-JPN,2016,361,,Natural,Meteorological,Storm,Tropical cyclone,,Typhoon Chaba (Chyba?),Japan,JPN,Eastern Asia,Asia,Hokkaidoo province (Hokkaido island),,,,,,,,,Kph,,,,,2016,10,5,2016,10,6,,,,,,,,,,,,88.57345288,1,1661,,Hokkaidoo (Adm1).
2016-0538-JPN,2016,538,,Natural,Meteorological,Extreme temperature,Heat wave,,,Japan,JPN,Eastern Asia,Asia,"Yamanashi, Kawanehoncho,Shizuoka",,,,,,,,,°C,,,,,2016,8,6,2016,8,8,3,490,,,490,,,,,,,88.57345288,1,1687;1697,,"Sizuoka, Yamanasi (Adm1)."
2016-0341-KOR,2016,341,,Natural,Geophysical,Earthquake,Ground movement,,,Korea (the Republic of),KOR,Eastern Asia,Asia,Kyonju,,,,,,,,5,Richter,35.781,129.216,20:32,,2016,9,12,2016,9,12,,32,29800,,29832,,,,,21000,23709,88.57345288,1,2440,,Kyongsangbuk-do (Adm1).
2016-0316-LAO,2016,316,FF-2016-000093,Natural,Hydrological,Flood,,,,Lao People's Democratic Republic (the),LAO,South-Eastern Asia,Asia,"Luang Prabang city (Louangphrabang distrcit, Louangphabang province), Oudomxai, Salavan, Xaignabouli, Xiangkhouang, Houaphan, Bokeo provinces",Heavy rains,,,,,,,,Km2,,,,,2016,8,11,2016,8,20,5,,26328,,26328,,,,,50,56,88.57345288,1;2,1754;1757;1761;1763;1765;74347,18674,"Bokeo, Houaphan, Oudomxai, Salavan, Xaignabouli, Xiangkhouang (Adm1). Louangphrabang (Adm2)."
2016-9529-LKA,2016,9529,,Natural,Climatological,Drought,Drought,,,Sri Lanka,LKA,Southern Asia,Asia,Batticaloa District (Eastern province),,,,,,,,,Km2,,,,,2016,10,,2017,5,,,,900000,,900000,,,,,20000,22580,88.57345288,2,,25833,Batticaloa (Adm2).
2016-0333-MEX,2016,333,,Natural,Hydrological,Flood,Flash flood,,,Mexico,MEX,Central America,Americas,Durango city,Heavy rains,,,,,,,22329,Km2,23.672,-104.964,,,2016,9,29,2016,10,5,5,,3000,,3000,,,,,25000,28225,88.57345288,2,,19842,Durango (Adm2).
2016-0532-MEX,2016,532,,Natural,Hydrological,Flood,Flash flood,,,Mexico,MEX,Central America,Americas,"Tamaulipas, Veracruz, Chihuahua",Torrential rains,,,,,,,,Km2,,,,,2016,2,3,2016,2,6,2,,,3000,3000,,,,,,,88.57345288,1,2033;2055;2057,,"Chihuahua, Tamaulipas, Veracruz (Adm1)."
2016-0332-MEX,2016,332,,Natural,Hydrological,Flood,,,,Mexico,MEX,Central America,Americas,"Guerrero, Chiapas states",Heavy rains,,,,,,,127234,Km2,17.071,-93.805,,,2016,9,14,2016,9,22,13,,6000,,6000,,,,,,,88.57345288,1,2039,,Guerrero (Adm1).
2016-0335-MKD,2016,335,,Natural,Geophysical,Earthquake,Ground movement,,,Macedonia (the former Yugoslav Republic of),MKD,Southern Europe,Europe,Skopje province,,,,,,,,5,Richter,42.009,21.49,15:10,,2016,9,11,2016,9,11,,100,,,100,,,,,10000,11290,88.57345288,1,2948,,Skopje (Adm1).
2016-0383-MMR,2016,383,,Natural,Geophysical,Earthquake,Ground movement,,,Myanmar,MMR,South-Eastern Asia,Asia,"Magway, Mandalay, Rakhine, Sagaing provinces",,,,,,,,7,Richter,20.923,94.569,,,2016,8,24,2016,8,24,4,2,1150,,1152,,,,,10000,11290,88.57345288,1,2123;2130;2131;2133,,"Magway, Mandalay, Rakhine, Sagaing (Adm1)."
2016-0444-MMR,2016,444,,Natural,Biological,Epidemic,Viral disease,,Measles,Myanmar,MMR,South-Eastern Asia,Asia,"Lahe, Nanyun cities",,,,,,,,,Vaccinated,,,,,2016,8,22,2016,8,22,34,,,,,,,,,,,88.57345288,,,,
2016-0369-MMR,2016,369,FL-2016-000058,Natural,Hydrological,Flood,,,,Myanmar,MMR,South-Eastern Asia,Asia,"Sagaing, Mandalay, Bago, Ayeyarwady, Magway, Yangon, Kachin",Heavy rains,,,,,,,,Km2,,,,,2016,7,,2016,8,,5,,474560,,474560,,,,,2000,2258,88.57345288,1,2126;2127;2130;2131;2133;2136;41772;41773,,"Ayeyawaddy, Bago (E), Bago (W), Kachin, Magway, Mandalay, Sagaing, Yangon (Adm1)."
2016-0509-MNG,2016,509,CW-2017-000001,Natural,Meteorological,Extreme temperature,Severe winter conditions,,,Mongolia,MNG,Eastern Asia,Asia,"Arkhangai, Bayan-Ulgii, Bayankhongor, Bulgan, Dornod, Darkhan-Uul, Zavkhan, Orkhon, Uvurkhangai (Ovoxangai), Selenge, Uvs, Tuv (Tov), Khovd (Xovd), Khuvsgul (Xovsgol), Khentii (Xentii), Ulaanbaatar provinces",,,,Yes,,,,,°C,,,,,2016,12,23,2017,1,4,,,157000,,157000,,,,,,,88.57345288,1,2075;2076;2077;2078;2079;2081;2086;2087;2088;2090;2091;2092;2094;2095;2096;2097,,"Arxangai, Bayan-O'lgii, Bayanxongor, Bulgan, Darxan-Uul, Dornod, O'vorxangai, Orxon, Selenge, To'v, Ulaanbaatar, Uvs, Xentii, Xo'vsgol, Xovd, Zavxan (Adm1)."
2016-0307-MYS,2016,307,,Natural,Hydrological,Flood,,,,Malaysia,MYS,South-Eastern Asia,Asia,"Yan, Baling districts (Kedah province), Penang city (Timur Laut district, Pulau Pinang province)",Torrential rain,,,,,,,,Km2,,,,,2016,7,18,2016,7,19,,,441,,441,,,,,,,88.57345288,2,,37345;37355;37404,"Baling, Timur Laut, Yan (Adm2)."
2016-0489-MYS,2016,489,,Natural,Hydrological,Flood,,,,Malaysia,MYS,South-Eastern Asia,Asia,Terengganu province,Heavy rains,,,,,,,20486,Km2,5.122,102.56,,,2016,11,28,2016,12,7,,,400,,400,,,,,,,88.57345288,1,1904,,Terengganu (Adm1).
2016-0516-MYS,2016,516,FL-2017-000002,Natural,Hydrological,Flood,,,,Malaysia,MYS,South-Eastern Asia,Asia,"Bachok, Gua Musang, Jeli, Kota Bahru, Machang, Pasir Mas, Pasir Puteh, Tanah Merah, Tumpat, Kuala Krai districts (Kelantan state); Besut, Setiu, Hulu Terengganu, Marang, Dungun, Kemaman (Terengganu state); Kuala Kangsar (Perak state); Pahang; Johor; Sabah; Selangor",Continous rains,,,,,,,43580,Km2,4.7,102.411,,"Sungai Golok, Sungai Galas, Sungai Kelantan, ungai Besut, Sungai Terengganu and Sungai Setiu",2016,12,26,2017,1,23,,,25000,,25000,,,,,132000,149029,88.57345288,1;2,1891;1897;1901;1903,37356;37357;37358;37359;37360;37361;37362;37363;37364;37365;37393;37463;37464;37465;37466;37468;37469,"Johor, Pahang, Sabah, Selangor (Adm1). Bachok, Besut, Dungun, Gua Musang, Hulu Terengganu, Jeli, Kemaman, Kota Bharu, Kuala Kangsar, Kuala Krai, Machang, Marang, Pasir Mas, Pasir Puteh, Setiu, Tanah Merah, Tumpat (Adm2)."
2016-0447-NER,2016,447,EP-2016-000105,Natural,Biological,Epidemic,Viral disease,,Rift Valley,Niger (the),NER,Western Africa,Africa,"Tahoua, Tassara, Tilia, Madaoua,Tchintabaraden, Abalak, Keita",,,,,,,,,Vaccinated,,,,,2016,8,,2016,11,21,23,78,,,78,,,,,,,88.57345288,,,,
2016-0337-NGA,2016,337,,Natural,Hydrological,Flood,Riverine flood,,,Nigeria,NGA,Western Africa,Africa,"Gwaram, Dutse, Jahun, Ringim, Hadejia, Babura, Gumel, Malammadori, Birninkudu districts (Jigawa province)",Heavy rains,,,,,,,,Km2,,,,,2016,9,1,2016,9,20,18,,,12000,12000,,,,,,,88.57345288,2,,22800;22803;22806;22813;190991;191004;191018;191025;191060,"Babura, Birnin Kudu, Dutse, Gumel, Gwaram, Hadejia, Jahun, Malam Maduri, Ringim (Adm2)."
2016-0547-NGA,2016,547,EP-2017-000030,Natural,Biological,Epidemic,Viral disease,,Meningitis,Nigeria,NGA,Western Africa,Africa,"Zamfara, Sokoto, Katsina, Kebbi, Niger, Kano, Yobe, Jigawa, Plateau, Kogi, Adamawa, Delta, FCT, Nassarawa, Gombe, Taraba, Cross River, Osun, Lagos, Oyo, Benue",,,,,,,,,Vaccinated,,,,,2016,11,,2017,7,17,1166,14518,,,14518,,,,,,,88.57345288,,,,
2016-0576-NGA,2016,576,,Natural,Biological,Epidemic,Viral disease,,Lassa fever,Nigeria,NGA,Western Africa,Africa,"Ondo, Edo, Lagos, Plateau, Bauchi, Ogun, Ebonyi, Taraba, Nasarawa, Rivers, Kaduna, Gombe, Cross-River, Borno, Kano, Kogi, Enugu, Anambra, Lagos, Kwara",,,,,,,,,Vaccinated,,,,,2016,12,4,2017,11,10,121,914,,,914,,,,,,,88.57345288,,,,
2016-0433-NIC,2016,433,TC-2016-000125,Natural,Meteorological,Storm,Tropical cyclone,,Tropical storm Otto,Nicaragua,NIC,Central America,Americas,"Costa Caribe Sur, Chontales, Zelaya Central, Río San Juan",,,,,,,,,Kph,,,,,2016,11,17,2016,11,17,,,10570,,10570,,,,,,,88.57345288,1,2185;2186;2190;2200,,"Atlantico Norte, Atlantico Sur, Chontales, Rio San Juan (Adm1)."
2016-0387-PAK,2016,387,,Natural,Hydrological,Flood,,,,Pakistan,PAK,Southern Asia,Asia,Karachi district (Sindh province),Heavy rains,,,,,,,,Km2,,,,,2016,8,27,2016,8,28,10,,,,,,,,,,,88.57345288,2,,40392;40393;40394;40395,"Karachi Central District, Karachi East District, Karachi South District, Karachi West District (Adm2)."
2016-0464-PER,2016,464,,Natural,Geophysical,Earthquake,Ground movement,,,Peru,PER,South America,Americas,"Lampa, Paratia cities (Lampa district, Puno province)",,,,,,,,6,Richter,-15.321,-70.823,17:40,,2016,12,1,2016,12,1,1,17,200,40,257,,,,,,,88.57345288,2,,24170,Lampa (Adm2).
2016-0518-PER,2016,518,,Natural,Biological,Epidemic,Viral disease,,Yellow fever,Peru,PER,South America,Americas,Junin,,,,,,,,,Vaccinated,,,,,2016,,,2017,1,4,26,54,,,54,,,,,,,88.57345288,1,2339,,Junin (Adm1).
2016-0537-PHL,2016,537,,Natural,Geophysical,Earthquake,Ground movement,,,Philippines (the),PHL,South-Eastern Asia,Asia,Surigao city,,,,,,,,7,Richter,,,,,2016,3,30,2016,3,30,8,202,,,202,,,,,,,88.57345288,2,,67169,Surigao Del Norte (Adm2).
2016-0342-PHL,2016,342,,Natural,Meteorological,Storm,Tropical cyclone,,Typhoon Ferdie (Meranti),Philippines (the),PHL,South-Eastern Asia,Asia,"Ilocos Norte district (Region I (Ilocos region) province), Batanes, Cagayan districts (Region II (Cagayan valley) province)",,,,,,,,,Kph,,,,,2016,9,16,2016,9,16,,,16648,,16648,,,,,4913,5547,88.57345288,2,,24211;24215;24216,"Batanes, Cagayan, Ilocos Norte (Adm2)."
2016-0363-PHL,2016,363,TC-2016-000108,Natural,Meteorological,Storm,Tropical cyclone,,Typhoon Karen (Sarika),Philippines (the),PHL,South-Eastern Asia,Asia,"Pangasinan district (Region I (Ilocos region) province), Nueva Vizcaya, Quirino, Isabela districts (Region II (Cagayan valley) province), Aurora, Bulacan, Nueva Ecija, Zambales districts (Region III (Central Luzon) province), Quezon, Rizal, Laguna, Cavite, Batangas districts (Region IV-A (Calabarzon) province), Albay, Catanduanes, Camarines Sur, Camarines Norte, Sorsogon districts (Region V (Bicol region) province)",,,,,,,,210,Kph,,,,,2016,10,16,2016,10,19,,,52270,,52270,,,,,11490,12972,88.57345288,2,,24214;24217;24218;24219;24221;24222;24225;24226;24227;24228;24229;24234;24235;24240;24241;24242;24243;24245,"Albay, Aurora, Batangas, Bulacan, Camarines Norte, Camarines Sur, Catanduanes, Cavite, Isabela, Laguna, Nueva Ecija, Nueva Vizcaya, Pangasinan, Quezon, Quirino, Rizal, Sorsogon, Zambales (Adm2)."
2016-0364-PHL,2016,364,TC-2016-000110,Natural,Meteorological,Storm,Tropical cyclone,,Typhoon Lawin (Haima),Philippines (the),PHL,South-Eastern Asia,Asia,"Ilocos Norte, Ilocos Sur, La Union, Pangasinan districts (Region I (Ilocos region) province), Cagayan, Isabela, Nueva Vizcaya, Quirino districts (Region II (Cagayan valley) province), Aurora, Bataan, Bulacan, Nueva Ecija, Pampanga, Tarlac, Zambales districts (Region III (Central Luzon) province), Batangas, Quezon, Rizal districts (Regio IV-A (Calabarzon) province), Camarines Norte, Sorgoson (Region V (Bicol region) province)), Abra, Apayao, Benguet, Ifugao, Kalinga, Mountain province (Cordillera Administrative region (CAR))",,,,,,,,215,Kph,,,,,2016,10,19,2016,10,21,8,,981154,,981154,,,,,50690,57229,88.57345288,2,,24204;24205;24206;24207;24208;24209;24211;24212;24213;24214;24216;24217;24218;24219;24220;24221;24222;24223;24224;24225;24226;24227;24234;24235;24241;24245,"Abra, Apayao, Aurora, Bataan, Batangas, Benguet, Bulacan, Cagayan, Camarines Norte, Ifugao, Ilocos Norte, Ilocos Sur, Isabela, Kalinga, La Union, Mountain Province, Nueva Ecija, Nueva Vizcaya, Pampanga, Pangasinan, Quezon, Quirino, Rizal, Sorsogon, Tarlac, Zambales (Adm2)."
2016-0503-PHL,2016,503,TC-2016-000134,Natural,Meteorological,Storm,Tropical cyclone,,Typhoon 'Nina' (Nock-Ten),Philippines (the),PHL,South-Eastern Asia,Asia,"Batangas, Cavite, Laguna, Quezon, Rizal (Calabarzon); Mariduque, Mindoro Occidental (Mimaropa); Albay, Camarines Norte, Camarines Sur, Catanduanes , Masbate, Sorsogon (Region V, Bicol region); Northern Samar (Region VIII, Eastern Visayas)",,,,,,Yes,,185,Kph,,,,,2016,12,25,2016,12,26,24,,1893404,,1893404,,,,,103661,117034,88.57345288,2,,24227;24228;24229;24230;24231;24234;24235;24240;24241;24242;24243;24244;24245;24259,"Albay, Batangas, Camarines Norte, Camarines Sur, Catanduanes, Cavite, Laguna, Marinduque, Masbate, Mindoro Occidental, Northern Samar, Quezon, Rizal, Sorsogon (Adm2)."
2016-0377-PHL,2016,377,,Natural,Hydrological,Flood,,,,Philippines (the),PHL,South-Eastern Asia,Asia,"National Capital Region (NCR) province, Ilocos Sur, La Union, Pangasinan districts (Region I (Ilocos Region) province), Bataan, Bulacan, Nueva Ecija, Pampanga, Tarlac, Zambales districts (Region III (Central Luzon) province), Laguna, Rizal districts (Region IV-A (Calabarzon) province), Antique, Iloilo, Negros Occidental districts (Region VI (Western Visaya) province), Abra, Benguet, Ifugao, Mountain province districts (Cordillera Administrative region (CAR) province)",Monsooonal rains (Hagabat),,,,,,,,Km2,,,,,2016,8,8,2016,8,16,26,,1263098,,1263098,,,,,9320,10522,88.57345288,1;2,2355,24204;24206;24207;24209;24212;24213;24214;24220;24221;24222;24223;24224;24225;24229;24235;24247;24250;24251,"National Capital region (NCR) (Adm1). Abra, Antique, Bataan, Benguet, Bulacan, Ifugao, Ilocos Sur, Iloilo, La Union, Laguna, Mountain Province, Negros Occidental, Nueva Ecija, Pampanga, Pangasinan, Rizal, Tarlac, Zambales (Adm2)."
2016-0445-PHL,2016,445,,Natural,Hydrological,Flood,,,,Philippines (the),PHL,South-Eastern Asia,Asia,"Pampanga district (Region III (Central Luzon) province), Pangasinan district (Region I (Ilocos region) province)",Monsoonal rains,,,,,Yes,,,Km2,,,,,2016,8,18,2016,8,22,19,,1300000,,1300000,,,,,,,88.57345288,2,,24214;24223,"Pampanga, Pangasinan (Adm2)."
2016-0321-PRK,2016,321,FL-2016-000097,Natural,Hydrological,Flood,Riverine flood,,,Korea (the Democratic People's Republic of),PRK,Eastern Asia,Asia,"Hamgyong-bukto province (North Hamgyong), Ryanggang","Heavy rains, remmants of Typhoon Lionrock",,,Yes,,,,,Km2,,,,Tuman river and tributaries,2016,8,29,2016,9,6,538,,667715,,667715,,,,,61000,68869,88.57345288,1,1058;1065,,"Hamgyong-bukto, Yanggang-do (Adm1)."
2016-0531-PRK,2016,531,,Natural,Hydrological,Flood,,,,Korea (the Democratic People's Republic of),PRK,Eastern Asia,Asia,,,,,,,,,,Km2,,,,,2016,7,22,2016,7,24,14,,,,,,,,,,,88.57345288,1,1054;1055;1056;1058;1059;1060;1061;1062;1063;1064;1065,,"Chagang-do, Hamgyong-bukto, Hamgyong-namdo, Hwanghae-bukto, Hwanghae-namdo, Kaesong-si, Kangwon-do, P'yongan-bukto, P'yongan-namdo, P'yongyang-si, Yanggang-do (Adm1)."
2016-0426-ROU,2016,426,,Natural,Hydrological,Flood,Riverine flood,,,Romania,ROU,Eastern Europe,Europe,"Slobozia-Conachi, Cuza Voda, Pechea (Galati province), Bucuresti, Bacau, Botosani provinces",Heavy rains,,,,,,,57183,Km2,45.151,27.562,,"Geru, Suhu",2016,10,9,2016,10,16,1,,300,,300,,,,,,,88.57345288,1,2449;2452;2455;2464,,"Bacau, Botosani, Bucuresti, Galati (Adm1)."
2017-0382-MEX,2017,382,,Natural,Geophysical,Earthquake,Ground movement,,,Mexico,MEX,Central America,Americas,"Oaxaca (Juchitan), Chiapas (Cintapala),Tabasco states",,Tsunami/Tidal wave,"Slide (land, mud, snow, rock)",,,Yes,,8,Richter,15.022,-93.899,23:49,,2017,9,8,2017,9,8,98,250,1200000,,1200250,,,400000,442184,2300000,2542555,90.46017931,1,2032;2047;2054,,"Chiapas, Oaxaca, Tabasco (Adm1)."
2017-0410-HND,2017,410,TC-2017-000148,Natural,Meteorological,Storm,Tropical cyclone,,Tropical depression'16/Hurricane 'Nate',Honduras,HND,Central America,Americas,"Ocotepeque, Copán, Lempira, Intibucá, Santa Bárbara, Comayagua departements, Francisco Morazan (San Ignacio), Atlantida (El Porvenir), El Paraiso (Trojes), Valle (San Lorenzo, Nacaome Paso Hondo in Goascoran)",,Flood,"Slide (land, mud, snow, rock)",,,,,,Kph,,,,,2017,10,5,2017,10,6,3,,120,,120,,,,,,,90.46017931,1;2,1420;1423;1424;1426;1428;1431;1433;1436;1437,17437,"Atlantida, Comayagua, Copan, Francisco Morazan, Intibuca, Lempira, Ocotepeque, Santa Barbara, Valle (Adm1). El Paraiso (Adm2)."
2017-0152-IND,2017,152,TC-2017-000058,Natural,Meteorological,Storm,Tropical cyclone,,Cyclone Mora,India,IND,Southern Asia,Asia,"Manipur, Mizoram",,Flood,"Slide (land, mud, snow, rock)",,,,,,Kph,,,,,2017,5,30,2017,5,31,,,1970,,1970,,,,,,,90.46017931,1,1500;1502,,"Manipur, Mizoram (Adm1)."
2017-0408-ITA,2017,408,,Natural,Meteorological,Storm,Convective storm,Lightning/Thunderstorms,,Italy,ITA,Southern Europe,Europe,"Livourne, Rosignano, Chioma",,Flood,"Slide (land, mud, snow, rock)",,,,,,Kph,,,,,2017,9,9,2017,9,10,9,,1000,,1000,,,,,216000,238779,90.46017931,2,,18402,Livorno (Adm2).
2017-0432-JPN,2017,432,,Natural,Meteorological,Storm,Tropical cyclone,,Typhoon 'Lan'/'Paolo',Japan,JPN,Eastern Asia,Asia,"Honshu Island: Fukuoka, Mie, Osaka, Toyama, Wakayama, Ibaraki, Nagano, Hokkaido",,Flood,"Slide (land, mud, snow, rock)",,,,,216,Kph,,,,,2017,10,22,2017,10,22,8,210,18600,,18810,,,,,1000000,1105459,90.46017931,1,1656;1661;1663;1672;1675;1682;1692;1694,,"Hokkaidoo, Hukuoka, Ibaraki, Mie, Nagano, Oosaka, Toyama, Wakayama (Adm1)."
2017-0468-JPN,2017,468,,Natural,Meteorological,Storm,Tropical cyclone,,Typhoon 'Talim',Japan,JPN,Eastern Asia,Asia,"Oita (Bungo-ono), Kagawa (Mitoyo city), Okayama, Ehime, Kochi, Kyoto, Miyazaki, Hyogo",,Flood,"Slide (land, mud, snow, rock)",,,,,160,Kph,,,,,2017,9,17,2017,9,19,2,56,21600,,21656,,,330000,364801,500000,552729,90.46017931,1,1654;1662;1666;1669;1671;1674;1679;1680,,"Ehime, Hyoogo, Kagawa, Kooti, Kyooto, Miyazaki, Okayama, Ooita (Adm1)."
2017-0508-LKA,2017,508,TC-2017-000172,Natural,Meteorological,Storm,Tropical cyclone,,Cyclone 'Ockhi',Sri Lanka,LKA,Southern Asia,Asia,"Galle, Matara (Southern), Colombo, Badulla (Uva), Gampaha, Kalutara (Western), Nuwara Eliya (Central)",,Flood,"Slide (land, mud, snow, rock)",,,,,130,Kph,,,,"Nilwala, Gin, and Kalu Rivers",2017,11,29,2017,12,1,27,77,160000,,160077,,,,,346000,382489,90.46017931,2,,25846;25848;25849;25851;25852;25853;41749,"Badulla, Colombo, Galle, Gampaha, Kalutara, Matara, Nuwara Eliya (Adm2)."
2017-0485-MAC,2017,485,,Natural,Meteorological,Storm,Tropical cyclone,,Tropical storm 'Pakhar'/'Jolina',Macao,MAC,Eastern Asia,Asia,,,Flood,"Slide (land, mud, snow, rock)",,,,,,Kph,,,,,2017,8,27,2017,8,27,,,,,,,,,,,,90.46017931,1,1879,,Administrative unit not available (Adm1).
2017-0168-MEX,2017,168,,Natural,Meteorological,Storm,Tropical cyclone,,Beatriz,Mexico,MEX,Central America,Americas,"Sierra Madre del Sur, Sierra Madre de Chiapas Mountain ranges, Oaxaca State, San Francisco Ozolotepec, San Marcial Ozolotepec, San Pedro Quiatoni, San Carlos Yautepec, Jamiltepec, Juquila, and Pochutla, Tehuantepec in Istmo Region, Juchitan district, San Pablo Topiltepec",,Flood,"Slide (land, mud, snow, rock)",,,,,65,Kph,,,19:00,Los Perros,2017,6,1,2017,6,3,6,,,600,600,,,,,,,90.46017931,1,2047,,Oaxaca (Adm1).
2017-0334-MEX,2017,334,,Natural,Meteorological,Storm,Tropical cyclone,,Hurricane 'Franklin',Mexico,MEX,Central America,Americas,"Quintana Roo State (Yucatan Peninsula); Campeche, Tabasco and Chiapas, Lechuguillas (Veracruz state); Puebla, Hidalgo states",,Flood,"Slide (land, mud, snow, rock)",,,,,140,Kph,,,,,2017,8,7,2017,8,7,,,300,,300,,,,,2000,2211,90.46017931,1,2031;2032;2040;2048;2050;2054;2057,,"Campeche, Chiapas, Hidalgo, Puebla, Quintana Roo, Tabasco, Veracruz (Adm1)."
